{
  "id": "the-dangers-in-my-heart",
  "type": "manga",
  "title": "The Dangers in My Heart",
  "alt_titles": [
    "Boku no Kokoro no Yabai Yatsu",
    "僕の心のヤバイやつ"
  ],
  "source": "AniList",
  "source_id": 101557,
  "description": "Ichikawa Kyoutarou, a boy barely clinging to the bottom rung of his school’s social ladder, secretly believes he’s the tortured lead in some psychological thriller. He spends his days dreaming up ways to disrupt his classmates’ peaceful lives and pining after Anna Yamada, the class idol. But Kyotaro’s not nearly the troubled teen he pretends to be…and it turns out Anna’s a bit odd herself!\n\n(Source: Seven Seas Entertainment)\n\nNotes:\n\n- Winner of the Tsugi ni Kuru Web Manga 2020 Award.\n\n- Nominee for the 2020 Manga Taisho Award.",
  "metadata": {
    "format": "MANGA",
    "status": "RELEASING",
    "startDate": "2018-03-08",
    "endDate": null,
    "genres": [
      "Comedy",
      "Romance",
      "Slice of Life"
    ],
    "averageScore": 81,
    "popularity": 31526,
    "chapters": null,
    "volumes": null
  },
  "images": [
    {
      "url": "https://s4.anilist.co/file/anilistcdn/media/manga/cover/medium/bx101557-bEJu54cmVYxx.jpg",
      "type": "cover",
      "source": "AniList"
    },
    {
      "url": "https://s4.anilist.co/file/anilistcdn/media/manga/banner/101557-VR51QZfL5YcW.jpg",
      "type": "banner",
      "source": "AniList"
    }
  ],
  "external_ids": {
    "anilist": 101557
  },
  "tags": [
    "Heterosexual",
    "School",
    "Male Protagonist",
    "Coming of Age",
    "Female Protagonist",
    "Shounen"
  ],
  "updated_at": "2025-12-26T05:02:46.012Z",
  "created_at": "2025-12-26T05:02:46.012Z"
}