{
  "id": "vivy-fluorite-eyes-song",
  "type": "anime",
  "title": "Vivy -Fluorite Eye's Song-",
  "alt_titles": [
    "Vivy: Fluorite Eye’s Song",
    "Vivy -Fluorite Eye’s Song-"
  ],
  "source": "AniList",
  "source_id": 128546,
  "description": "An AI named Matsumoto appears before Vivy, the world’s first autonomous humanoid AI. Matsumoto’s mission is to rewrite history together with Vivy, in order to stop the war between AI and humans that will happen one century later.\n\n(Source: Funimation)",
  "metadata": {
    "format": "TV",
    "status": "FINISHED",
    "startDate": "2021-04-03",
    "endDate": "2021-06-19",
    "genres": [
      "Action",
      "Drama",
      "Music",
      "Sci-Fi",
      "Thriller"
    ],
    "averageScore": 82,
    "popularity": 162721,
    "episodes": 13
  },
  "images": [
    {
      "url": "https://s4.anilist.co/file/anilistcdn/media/anime/cover/medium/bx128546-UIwyhuhjxmL0.jpg",
      "type": "cover",
      "source": "AniList"
    },
    {
      "url": "https://s4.anilist.co/file/anilistcdn/media/anime/banner/128546-V5KVgbzQwFYm.jpg",
      "type": "banner",
      "source": "AniList"
    }
  ],
  "external_ids": {
    "anilist": 128546
  },
  "tags": [
    "Artificial Intelligence",
    "Robots",
    "Female Protagonist",
    "Time Manipulation",
    "Tragedy",
    "Time Skip",
    "Philosophy",
    "Guns",
    "War",
    "Terrorism",
    "Dystopian",
    "Musical Theater",
    "Cyberpunk",
    "Primarily Female Cast",
    "Kuudere",
    "Memory Manipulation",
    "Conspiracy",
    "Anthropomorphism",
    "Idol",
    "Dissociative Identities",
    "Politics",
    "Rehabilitation",
    "Amnesia",
    "Primarily Adult Cast"
  ],
  "updated_at": "2025-12-26T03:06:13.500Z",
  "created_at": "2025-12-26T03:06:13.500Z"
}