{
  "id": "the-apothecary-diaries",
  "type": "anime",
  "title": "The Apothecary Diaries",
  "alt_titles": [
    "Kusuriya no Hitorigoto",
    "薬屋のひとりごと"
  ],
  "source": "AniList",
  "source_id": 161645,
  "description": "Maomao lived a peaceful life with her apothecary father. Until one day, she’s sold as a lowly servant to the emperor’s palace. But she wasn’t meant for a compliant life among royalty. So when imperial heirs fall ill, she decides to step in and find a cure! This catches the eye of Jinshi, a handsome palace official who promotes her. Now, she’s making a name for herself solving medical mysteries!\n\n(Source: Crunchyroll)",
  "metadata": {
    "format": "TV",
    "status": "FINISHED",
    "startDate": "2023-10-22",
    "endDate": "2024-03-24",
    "genres": [
      "Drama",
      "Mystery"
    ],
    "averageScore": 88,
    "popularity": 243814,
    "episodes": 24
  },
  "images": [
    {
      "url": "https://s4.anilist.co/file/anilistcdn/media/anime/cover/medium/bx161645-QLbzHXiYRgV2.jpg",
      "type": "cover",
      "source": "AniList"
    },
    {
      "url": "https://s4.anilist.co/file/anilistcdn/media/anime/banner/161645-oqzTZYIvviWI.jpg",
      "type": "banner",
      "source": "AniList"
    }
  ],
  "external_ids": {
    "anilist": 161645
  },
  "tags": [
    "Female Protagonist",
    "Medicine",
    "Ancient China",
    "Drugs",
    "Historical",
    "Detective",
    "Conspiracy",
    "Politics",
    "Foreign",
    "Work",
    "Royal Affairs",
    "Primarily Adult Cast",
    "Adoption",
    "Heterosexual",
    "Seinen",
    "Episodic",
    "Alchemy",
    "Maids",
    "Unrequited Love",
    "Asexual",
    "Aromantic",
    "Pregnancy"
  ],
  "updated_at": "2025-12-24T02:05:19.164Z",
  "created_at": "2025-12-24T02:05:19.164Z"
}