{
  "id": "one-piece",
  "type": "anime",
  "title": "ONE PIECE",
  "alt_titles": [
    "ONE PIECE",
    "ONE PIECE"
  ],
  "source": "AniList",
  "source_id": 21,
  "description": "Gold Roger was known as the Pirate King, the strongest and most infamous being to have sailed the Grand Line. The capture and death of Roger by the World Government brought a change throughout the world. His last words before his death revealed the location of the greatest treasure in the world, One Piece. It was this revelation that brought about the Grand Age of Pirates, men who dreamed of finding One Piece (which promises an unlimited amount of riches and fame), and quite possibly the most coveted of titles for the person who found it, the title of the Pirate King.\n\nEnter Monkey D. Luffy, a 17-year-old boy that defies your standard definition of a pirate. Rather than the popular persona of a wicked, hardened, toothless pirate who ransacks villages for fun, Luffyâ€™s reason for being a pirate is one of pure wonder; the thought of an exciting adventure and meeting new and intriguing people, along with finding One Piece, are his reasons of becoming a pirate. Following in the footsteps of his childhood hero, Luffy and his crew travel across the Grand Line, experiencing crazy adventures, unveiling dark mysteries and battling strong enemies, all in order to reach One Piece.\n\n*This includes following special episodes:\n\n- Chopperman to the Rescue! Protect the TV Station by the Shore! (Episode 336)\n\n- The Strongest Tag-Team! Luffy and Toriko's Hard Struggle! (Episode 492)\n\n- Team Formation! Save Chopper (Episode 542)\n\n- History's Strongest Collaboration vs. Glutton of the Sea (Episode 590)\n\n- 20th Anniversary! Special Romance Dawn (Episode 907)",
  "metadata": {
    "format": "TV",
    "status": "RELEASING",
    "startDate": "1999-10-20",
    "endDate": null,
    "genres": [
      "Action",
      "Adventure",
      "Comedy",
      "Drama",
      "Fantasy"
    ],
    "averageScore": 88,
    "popularity": 648019,
    "episodes": null
  },
  "images": [
    {
      "url": "https://s4.anilist.co/file/anilistcdn/media/anime/cover/medium/bx21-ELSYx3yMPcKM.jpg",
      "type": "cover",
      "source": "AniList"
    },
    {
      "url": "https://s4.anilist.co/file/anilistcdn/media/anime/banner/21-wf37VakJmZqs.jpg",
      "type": "banner",
      "source": "AniList"
    }
  ],
  "external_ids": {
    "anilist": 21
  },
  "tags": [
    "Pirates",
    "Travel",
    "Shounen",
    "Ensemble Cast",
    "Super Power",
    "Found Family",
    "Male Protagonist",
    "Slapstick",
    "Tragedy",
    "Conspiracy",
    "Ships",
    "Time Skip",
    "Politics",
    "Dystopian",
    "War",
    "Slavery",
    "Fugitive",
    "Gods",
    "Crime",
    "Philosophy",
    "Swordplay",
    "Monster Boy",
    "Prison",
    "Lost Civilization",
    "Henshin",
    "Anthropomorphism",
    "Food",
    "Robots",
    "Shapeshifting",
    "Cyborg",
    "Primarily Adult Cast",
    "Samurai",
    "Medicine",
    "Animals",
    "Desert",
    "Guns",
    "Anti-Hero",
    "Skeleton",
    "Anachronism",
    "Dragons",
    "Asexual",
    "Nudity",
    "Demons",
    "Artificial Intelligence",
    "Espionage",
    "Monster Girl",
    "Marriage"
  ],
  "updated_at": "2025-12-22T12:45:39.305Z",
  "created_at": "2025-12-22T12:17:12.015Z"
}