{
  "id": "akashic-records-of-bastard-magic-instructor",
  "type": "anime",
  "title": "Akashic Records of Bastard Magic Instructor",
  "alt_titles": [
    "Rokudenashi Majutsu Koushi to Akashic Records",
    "ロクでなし魔術講師と禁忌教典(アカシックレコード)"
  ],
  "source": "AniList",
  "source_id": 21700,
  "description": "In the \"action fantasy\" story, Glenn is a part-time teacher at a magic school who is inclined to write \"self-study\" on the blackboard and then take a nap. One of his students, Sistine, gets angry and challenges him to a duel and he is easily defeated. However, when a terrible incident threatens the school, Glenn shows intense dedication to protecting his students.\n\n(Source: Anime News Network)",
  "metadata": {
    "format": "TV",
    "status": "FINISHED",
    "startDate": "2017-04-04",
    "endDate": "2017-06-20",
    "genres": [
      "Action",
      "Comedy",
      "Fantasy"
    ],
    "averageScore": 68,
    "popularity": 176474,
    "episodes": 12
  },
  "images": [
    {
      "url": "https://s4.anilist.co/file/anilistcdn/media/anime/cover/medium/bx21700-HhTEXPZKxupP.jpg",
      "type": "cover",
      "source": "AniList"
    },
    {
      "url": "https://s4.anilist.co/file/anilistcdn/media/anime/banner/21700-3JaMOphL8VGr.jpg",
      "type": "banner",
      "source": "AniList"
    }
  ],
  "external_ids": {
    "anilist": 21700
  },
  "tags": [
    "Magic",
    "School",
    "Teacher",
    "Male Protagonist",
    "Primarily Female Cast",
    "Tsundere",
    "Anti-Hero"
  ],
  "updated_at": "2025-12-25T14:53:25.793Z",
  "created_at": "2025-12-25T14:53:25.793Z"
}