{
  "id": "charlotte",
  "type": "anime",
  "title": "Charlotte",
  "alt_titles": [
    "Charlotte(シャーロット)"
  ],
  "source": "AniList",
  "source_id": 20997,
  "description": "The story centers around the special abilities that occur among a small percentage of boys and girls in puberty. Yuu Otosaka uses his power without others knowing, and lives a fairly normal, average school life. Before him suddenly appears a girl, Nao Tomori. Due to his meeting with her, the fate of special power-users will be exposed.\n\n(Source: Anime News Network)",
  "metadata": {
    "format": "TV",
    "status": "FINISHED",
    "startDate": "2015-07-05",
    "endDate": "2015-09-27",
    "genres": [
      "Comedy",
      "Drama",
      "Romance",
      "Sci-Fi",
      "Supernatural"
    ],
    "averageScore": 75,
    "popularity": 385891,
    "episodes": 13
  },
  "images": [
    {
      "url": "https://s4.anilist.co/file/anilistcdn/media/anime/cover/medium/bx20997-axVYrsIfjtYJ.jpg",
      "type": "cover",
      "source": "AniList"
    },
    {
      "url": "https://s4.anilist.co/file/anilistcdn/media/anime/banner/20997-nE9VyUa08vS0.jpg",
      "type": "banner",
      "source": "AniList"
    }
  ],
  "external_ids": {
    "anilist": 20997
  },
  "tags": [
    "Super Power",
    "Time Manipulation",
    "Tragedy",
    "Urban Fantasy",
    "Primarily Teen Cast",
    "Urban",
    "Male Protagonist",
    "School Club",
    "School",
    "Body Swapping",
    "Amnesia",
    "Female Protagonist",
    "Dissociative Identities",
    "Tsundere",
    "Survival",
    "Memory Manipulation"
  ],
  "updated_at": "2025-12-22T13:36:54.783Z",
  "created_at": "2025-12-22T13:36:54.783Z"
}