{
  "id": "darker-than-black",
  "type": "anime",
  "title": "Darker than Black",
  "alt_titles": [
    "DARKER THAN BLACK: Kuro no Keiyakusha",
    "DARKER THAN BLACK -黒の契約者-"
  ],
  "source": "AniList",
  "source_id": 2025,
  "description": "In Tokyo, an impenetrable field known as \"Hell's Gate\" appeared ten years ago. At the same time, psychics who wield paranormal powers at the cost of their conscience also emerged. Hei is one of the most powerful of these psychic agents, and along with his blind associate, Yin, works for one of the many rival agencies vying to unlock the mysteries of Hell's Gate.\n\n(Source: Anime News Network)",
  "metadata": {
    "format": "TV",
    "status": "FINISHED",
    "startDate": "2007-04-06",
    "endDate": "2007-09-28",
    "genres": [
      "Action",
      "Mystery",
      "Sci-Fi"
    ],
    "averageScore": 77,
    "popularity": 161079,
    "episodes": 25
  },
  "images": [
    {
      "url": "https://s4.anilist.co/file/anilistcdn/media/anime/cover/medium/b2025-ZKVteVzUyFLH.png",
      "type": "cover",
      "source": "AniList"
    },
    {
      "url": "https://s4.anilist.co/file/anilistcdn/media/anime/banner/2025-Fx3ALDmrOulv.jpg",
      "type": "banner",
      "source": "AniList"
    }
  ],
  "external_ids": {
    "anilist": 2025
  },
  "tags": [
    "Super Power",
    "Anti-Hero",
    "Noir",
    "Crime",
    "Urban",
    "Assassins",
    "Conspiracy",
    "Tragedy",
    "Terrorism",
    "Urban Fantasy",
    "Police",
    "Espionage",
    "Triads",
    "Episodic",
    "Kuudere",
    "Gore",
    "Male Protagonist"
  ],
  "updated_at": "2025-12-26T04:14:14.972Z",
  "created_at": "2025-12-26T04:14:14.972Z"
}