{
  "id": "beastars",
  "type": "anime",
  "title": "BEASTARS",
  "alt_titles": [
    "BEASTARS",
    "BEASTARS"
  ],
  "source": "AniList",
  "source_id": 107660,
  "description": "In a world populated by anthropomorphic animals, herbivores and carnivores coexist with each other. For the adolescents of Cherryton Academy, school life is filled with hope, romance, distrust, and uneasiness.\n\nThe main character is Legoshi the wolf, a member of the drama club. Despite his menacing appearance, he has a very gentle heart. Throughout most of his life, he has always been an object of fear and hatred by other animals, and heâ€™s been quite accustomed to that lifestyle. But soon, he finds himself becoming more involved with his fellow classmates who have their own share of insecurities and finds his life in school changing slowly.\n\n(Source: moetron)",
  "metadata": {
    "format": "TV",
    "status": "FINISHED",
    "startDate": "2019-10-10",
    "endDate": "2019-12-26",
    "genres": [
      "Drama",
      "Mystery",
      "Psychological",
      "Romance",
      "Slice of Life"
    ],
    "averageScore": 77,
    "popularity": 237090,
    "episodes": 12
  },
  "images": [
    {
      "url": "https://s4.anilist.co/file/anilistcdn/media/anime/cover/medium/bx107660-hgknnyaLchJW.png",
      "type": "cover",
      "source": "AniList"
    },
    {
      "url": "https://s4.anilist.co/file/anilistcdn/media/anime/banner/107660-AxwrzHkXzYYN.jpg",
      "type": "banner",
      "source": "AniList"
    }
  ],
  "external_ids": {
    "anilist": 107660
  },
  "tags": [
    "Anthropomorphism",
    "Coming of Age",
    "Animals",
    "Cannibalism",
    "Full CGI",
    "Primarily Teen Cast",
    "School",
    "Male Protagonist",
    "Boarding School",
    "CGI",
    "Psychosexual",
    "Female Protagonist",
    "Love Triangle",
    "Gangs",
    "Ensemble Cast",
    "Heterosexual",
    "Philosophy",
    "Crime",
    "Bullying",
    "Shounen",
    "School Club",
    "Gore",
    "Acting",
    "Primarily Animal Cast"
  ],
  "updated_at": "2025-12-24T04:04:39.933Z",
  "created_at": "2025-12-24T04:04:39.933Z"
}