{
  "id": "goblin-slayer",
  "type": "anime",
  "title": "GOBLIN SLAYER",
  "alt_titles": [
    "Goblin Slayer",
    "ゴブリンスレイヤー"
  ],
  "source": "AniList",
  "source_id": 101165,
  "description": "A young priestess has formed her first adventuring party, but almost immediately they find themselves in distress. It's the Goblin Slayer who comes to their rescue--a man who's dedicated his life to the extermination of all goblins, by any means necessary. And when rumors of his feats begin to circulate, there's no telling who might come calling next...\n\n(Source: Yen Press)",
  "metadata": {
    "format": "TV",
    "status": "FINISHED",
    "startDate": "2018-10-07",
    "endDate": "2018-12-30",
    "genres": [
      "Action",
      "Adventure",
      "Fantasy"
    ],
    "averageScore": 71,
    "popularity": 271833,
    "episodes": 12
  },
  "images": [
    {
      "url": "https://s4.anilist.co/file/anilistcdn/media/anime/cover/medium/bx101165-v5NwPXWPFDuD.jpg",
      "type": "cover",
      "source": "AniList"
    },
    {
      "url": "https://s4.anilist.co/file/anilistcdn/media/anime/banner/101165-bXPZrNiQGPHd.jpg",
      "type": "banner",
      "source": "AniList"
    }
  ],
  "external_ids": {
    "anilist": 101165
  },
  "tags": [
    "Goblin",
    "Revenge",
    "Gore",
    "Tragedy",
    "Male Protagonist",
    "Rape",
    "Primarily Adult Cast",
    "Magic",
    "Dungeon"
  ],
  "updated_at": "2025-12-23T16:17:19.118Z",
  "created_at": "2025-12-23T16:17:19.118Z"
}